<?xml version="1.0" encoding="UTF-8"?>
<xs:schema xmlns:xs="http://www.w3.org/2001/XMLSchema">
	<xs:simpleType name="eduroam_institution_type">
		<xs:restriction base="xs:int">
			<xs:enumeration value="1">
				<xs:annotation>
					<xs:documentation>IdP</xs:documentation>
				</xs:annotation>
			</xs:enumeration>
			<xs:enumeration value="2">
				<xs:annotation>
					<xs:documentation>SP</xs:documentation>
				</xs:annotation>
			</xs:enumeration>
			<xs:enumeration value="3">
				<xs:annotation>
					<xs:documentation>SPIdP</xs:documentation>
				</xs:annotation>
			</xs:enumeration>
		</xs:restriction>

	</xs:simpleType>

	<xs:element name="institutions">
		<xs:complexType>
			<xs:sequence maxOccurs="unbounded">
				<xs:element name="institution">
					<xs:complexType>
						<xs:sequence>
							<xs:element name="country" type="xs:string"/>
							<xs:element name="type" type="eduroam_institution_type"/>
							<xs:element name="inst_realm" type="xs:string" maxOccurs="unbounded" minOccurs="0"/>
							<xs:element name="org_name" minOccurs="1" maxOccurs="unbounded">
								<xs:complexType>
									<xs:simpleContent>
										<xs:extension base="xs:string">
											<xs:attribute name="lang" type="xs:string" use="required"/>
										</xs:extension>
									</xs:simpleContent>
								</xs:complexType>
							</xs:element>
							<xs:element name="address">
								<xs:complexType>
									<xs:sequence>
										<xs:element name="street" type="xs:string"/>
										<xs:element name="city" type="xs:string"/>
									</xs:sequence>
								</xs:complexType>
							</xs:element>
							<xs:element name="contact" maxOccurs="unbounded">
								<xs:complexType>
									<xs:sequence>
										<xs:element name="name" type="xs:string"/>
										<xs:element name="email" type="xs:string"/>
										<xs:element name="phone" type="xs:string"/>
									</xs:sequence>
								</xs:complexType>
							</xs:element>
							<xs:element name="info_URL" minOccurs="1" maxOccurs="unbounded">
								<xs:complexType>
									<xs:simpleContent>
										<xs:extension base="xs:anyURI">
											<xs:attribute name="lang" type="xs:string" use="required"/>
										</xs:extension>
									</xs:simpleContent>
								</xs:complexType>
							</xs:element>
							<xs:element name="policy_URL" maxOccurs="unbounded">
								<xs:complexType>
									<xs:simpleContent>
										<xs:extension base="xs:anyURI">
											<xs:attribute name="lang" type="xs:string" use="required"/>
										</xs:extension>
									</xs:simpleContent>
								</xs:complexType>
							</xs:element>
							<xs:element name="ts" type="xs:dateTime">
								<xs:annotation>
									<xs:documentation> Format: 2008-02-29T12:00:00 </xs:documentation>
								</xs:annotation>
							</xs:element>

							<xs:element name="location" maxOccurs="unbounded" minOccurs="0">
								<xs:complexType>
									<xs:sequence>										
										<xs:element name="longitude" type="xs:string"/>
										<xs:element name="latitude" type="xs:string"/>
										<xs:element name="loc_name" minOccurs="0" maxOccurs="unbounded">
											<xs:complexType>
												<xs:simpleContent>
													<xs:extension base="xs:string">
														<xs:attribute name="lang" type="xs:string" use="required"/>
													</xs:extension>
												</xs:simpleContent>
											</xs:complexType>
										</xs:element>
										<xs:element name="address">
											<xs:complexType>
												<xs:sequence>
													<xs:element name="street" type="xs:string"/>
													<xs:element name="city" type="xs:string"/>
												</xs:sequence>
											</xs:complexType>
										</xs:element>
										<xs:element name="contact" maxOccurs="unbounded" minOccurs="0">
											<xs:complexType>
												<xs:sequence>
													<xs:element name="name" type="xs:string"/>
													<xs:element name="email" type="xs:string"/>
													<xs:element name="phone" type="xs:string"/>
												</xs:sequence>
											</xs:complexType>
										</xs:element>
										<xs:element name="SSID" type="xs:string"/>
										<xs:element name="enc_level" type="xs:string"/>
										<xs:element name="port_restrict" type="xs:boolean" default="0"/>
										<xs:element name="transp_proxy" type="xs:boolean" default="0" minOccurs="0"/>
										<xs:element name="IPv6" type="xs:boolean" default="0" minOccurs="0"/>
										<xs:element name="NAT" type="xs:boolean" default="0" minOccurs="0"/>
										<xs:element name="AP_no" type="xs:int" minOccurs="0"/>
										<xs:element name="wired" type="xs:boolean" default="0" minOccurs="0"/>
										<xs:element name="info_URL" minOccurs="0" maxOccurs="unbounded">
											<xs:complexType>
												<xs:simpleContent>
													<xs:extension base="xs:anyURI">
														<xs:attribute name="lang" type="xs:string" use="required"/>
													</xs:extension>
												</xs:simpleContent>
											</xs:complexType>
										</xs:element>
									</xs:sequence>
								</xs:complexType>
							</xs:element>
						</xs:sequence>
					</xs:complexType>
				</xs:element>
			</xs:sequence>
		</xs:complexType>
	</xs:element>
</xs:schema>
